<DATAMODEL name="articlepicture" xmlns:xsi="http://www.w3.org/2001/XMLSchema-instance" xsi:noNamespaceSchemaLocation="datamodel.xsd">
			<NODE name="idArticlePicture" type="int" nullable="false" autoincrement="true" lenght="11"/>
    		<NODE name="idArticle" type="int" nullable="false" autoincrement="false" lenght="11"/>
    		<NODE name="locale" type="string" nullable="true" autoincrement="false" lenght="50"/>
    		<NODE name="name" type="string" nullable="true" autoincrement="false" lenght="45"/>
    		<NODE name="description" type="string" nullable="true" autoincrement="false" lenght="1000"/>
    		<NODE name="picture" type="blob" nullable="false" autoincrement="false" lenght="19"/>
    		<NODE name="pictureThumbnail" type="blob" nullable="false" autoincrement="false" lenght="19"/>
    		<NODE name="pictureMedium" type="blob" nullable="false" autoincrement="false" lenght="19"/>
    </DATAMODEL>
