<DATAMODEL name="jobs" xmlns:xsi="http://www.w3.org/2001/XMLSchema-instance" xsi:noNamespaceSchemaLocation="datamodel.xsd">
			<NODE name="idBusinessUnit" type="int" nullable="false" autoincrement="false" lenght="11"/>
    		<NODE name="jobName" type="string" nullable="false" autoincrement="false" lenght="45"/>
    		<NODE name="idContact" type="int" nullable="true" autoincrement="false" lenght="11"/>
    		<NODE name="idContactContract" type="int" nullable="true" autoincrement="false" lenght="11"/>
    		<NODE name="contractCode" type="string" nullable="true" autoincrement="false" lenght="10"/>
    		<NODE name="idUserContact" type="int" nullable="false" autoincrement="false" lenght="11"/>
    		<NODE name="creationDate" type="datetime" nullable="false" autoincrement="false" lenght="19"/>
    		<NODE name="description" type="string" nullable="true" autoincrement="false" lenght="255"/>
    		<NODE name="state" type="int" nullable="false" autoincrement="false" lenght="2"/>
    		<NODE name="idCatalog" type="int" nullable="true" autoincrement="false" lenght="11"/>
    		<NODE name="idArticle" type="int" nullable="true" autoincrement="false" lenght="11"/>
    </DATAMODEL>
