<DATAMODEL name="tag" xmlns:xsi="http://www.w3.org/2001/XMLSchema-instance" xsi:noNamespaceSchemaLocation="datamodel.xsd">
			<NODE name="idTag" type="int" nullable="false" autoincrement="true" lenght="11"/>
    		<NODE name="idTagCategory" type="int" nullable="false" autoincrement="false" lenght="11"/>
    		<NODE name="name" type="string" nullable="true" autoincrement="false" lenght="45"/>
    		<NODE name="shortName" type="string" nullable="true" autoincrement="false" lenght="45"/>
    		<NODE name="longName" type="string" nullable="true" autoincrement="false" lenght="255"/>
    		<NODE name="description" type="string" nullable="true" autoincrement="false" lenght="255"/>
    		<NODE name="type" type="string" nullable="false" autoincrement="false" lenght="1"/>
    		<NODE name="pk" type="string" nullable="false" autoincrement="false" lenght="1"/>
    		<NODE name="constraints" type="string" nullable="true" autoincrement="false" lenght="45"/>
    </DATAMODEL>
