<DATAMODEL name="taskmessage" xmlns:xsi="http://www.w3.org/2001/XMLSchema-instance" xsi:noNamespaceSchemaLocation="datamodel.xsd">
			<NODE name="idTaskMessage" type="int" nullable="false" autoincrement="true" lenght="11"/>
    		<NODE name="senderContactId" type="int" nullable="false" autoincrement="false" lenght="11"/>
    		<NODE name="idBusinessUnit" type="int" nullable="false" autoincrement="false" lenght="11"/>
    		<NODE name="validityFrom" type="datetime" nullable="false" autoincrement="false" lenght="19"/>
    		<NODE name="sentDate" type="datetime" nullable="false" autoincrement="false" lenght="19"/>
    		<NODE name="dueDate" type="datetime" nullable="true" autoincrement="false" lenght="19"/>
    		<NODE name="message" type="string" nullable="false" autoincrement="false" lenght="500"/>
    		<NODE name="type" type="string" nullable="false" autoincrement="false" lenght="45"/>
    		<NODE name="docReference" type="string" nullable="true" autoincrement="false" lenght="500"/>
    		<NODE name="status" type="int" nullable="false" autoincrement="false" lenght="11"/>
    </DATAMODEL>
