<DATAMODEL name="statement" xmlns:xsi="http://www.w3.org/2001/XMLSchema-instance" xsi:noNamespaceSchemaLocation="datamodel.xsd">
			<NODE name="idStatement" type="int" nullable="false" autoincrement="true" lenght="11"/>
    		<NODE name="idBusinessUnit" type="int" nullable="false" autoincrement="false" lenght="11"/>
    		<NODE name="account" type="string" nullable="false" autoincrement="false" lenght="20"/>
    		<NODE name="accountExercise" type="int" nullable="false" autoincrement="false" lenght="4"/>
    		<NODE name="statementDate" type="datetime" nullable="true" autoincrement="false" lenght="19"/>
    		<NODE name="reference" type="string" nullable="true" autoincrement="false" lenght="45"/>
    		<NODE name="openingBalance" type="float" nullable="true" autoincrement="false" lenght="19"/>
    		<NODE name="closingBalance" type="float" nullable="true" autoincrement="false" lenght="19"/>
    		<NODE name="movement" type="float" nullable="true" autoincrement="false" lenght="19"/>
    		<NODE name="reconciliedAmount" type="float" nullable="true" autoincrement="false" lenght="19"/>
    		<NODE name="difference" type="float" nullable="true" autoincrement="false" lenght="19"/>
    		<NODE name="status" type="string" nullable="true" autoincrement="false" lenght="45"/>
    		<NODE name="type" type="string" nullable="true" autoincrement="false" lenght="45"/>
    </DATAMODEL>
