<DATAMODEL name="contactaddress" xmlns:xsi="http://www.w3.org/2001/XMLSchema-instance" xsi:noNamespaceSchemaLocation="datamodel.xsd">
			<NODE name="idContact" type="int" nullable="false" autoincrement="false" lenght="11"/>
    		<NODE name="idBusinessUnit" type="int" nullable="false" autoincrement="false" lenght="11"/>
    		<NODE name="idAddress" type="int" nullable="false" autoincrement="false" lenght="11"/>
    		<NODE name="validityFrom" type="datetime" nullable="false" autoincrement="false" lenght="19"/>
    		<NODE name="validityTo" type="datetime" nullable="true" autoincrement="false" lenght="19"/>
    		<NODE name="address1" type="string" nullable="true" autoincrement="false" lenght="255"/>
    		<NODE name="address2" type="string" nullable="true" autoincrement="false" lenght="255"/>
    		<NODE name="address3" type="string" nullable="true" autoincrement="false" lenght="255"/>
    		<NODE name="address4" type="string" nullable="true" autoincrement="false" lenght="255"/>
    		<NODE name="streetName" type="string" nullable="true" autoincrement="false" lenght="255"/>
    		<NODE name="streetNumber" type="string" nullable="true" autoincrement="false" lenght="45"/>
    		<NODE name="postalCode" type="string" nullable="true" autoincrement="false" lenght="20"/>
    		<NODE name="town" type="string" nullable="true" autoincrement="false" lenght="45"/>
    		<NODE name="county" type="string" nullable="true" autoincrement="false" lenght="45"/>
    		<NODE name="country" type="string" nullable="true" autoincrement="false" lenght="45"/>
    		<NODE name="addressType" type="string" nullable="false" autoincrement="false" lenght="1"/>
    		<NODE name="category" type="string" nullable="false" autoincrement="false" lenght="10"/>
    		<NODE name="longitude" type="float" nullable="true" autoincrement="false" lenght="19"/>
    		<NODE name="latitude" type="float" nullable="true" autoincrement="false" lenght="19"/>
    		<NODE name="centreLongitude" type="float" nullable="true" autoincrement="false" lenght="19"/>
    		<NODE name="centreLatitude" type="float" nullable="true" autoincrement="false" lenght="19"/>
    		<NODE name="scale" type="int" nullable="true" autoincrement="false" lenght="11"/>
    		<NODE name="mapType" type="string" nullable="true" autoincrement="false" lenght="45"/>
    		<NODE name="isoCountry" type="string" nullable="true" autoincrement="false" lenght="3"/>
    		<NODE name="postbox" type="string" nullable="true" autoincrement="false" lenght="45"/>
    </DATAMODEL>
