<DATAMODEL name="contactdashwidget" xmlns:xsi="http://www.w3.org/2001/XMLSchema-instance" xsi:noNamespaceSchemaLocation="datamodel.xsd">
			<NODE name="idContact" type="int" nullable="false" autoincrement="false" lenght="11"/>
    		<NODE name="idBusinessUnit" type="int" nullable="false" autoincrement="false" lenght="11"/>
    		<NODE name="dashboardName" type="string" nullable="false" autoincrement="false" lenght="45"/>
    		<NODE name="widgetName" type="string" nullable="false" autoincrement="false" lenght="255"/>
    		<NODE name="gridX" type="int" nullable="false" autoincrement="false" lenght="11"/>
    		<NODE name="gridY" type="int" nullable="false" autoincrement="false" lenght="11"/>
    		<NODE name="weightX" type="int" nullable="false" autoincrement="false" lenght="11"/>
    		<NODE name="weightY" type="int" nullable="false" autoincrement="false" lenght="11"/>
    		<NODE name="gridWidth" type="int" nullable="false" autoincrement="false" lenght="11"/>
    		<NODE name="gridHeight" type="int" nullable="false" autoincrement="false" lenght="11"/>
    </DATAMODEL>
