<DATAMODEL name="contactemployee" xmlns:xsi="http://www.w3.org/2001/XMLSchema-instance" xsi:noNamespaceSchemaLocation="datamodel.xsd">
			<NODE name="idContact" type="int" nullable="false" autoincrement="false" lenght="11"/>
    		<NODE name="idBusinessUnit" type="int" nullable="false" autoincrement="false" lenght="11"/>
    		<NODE name="validityFrom" type="datetime" nullable="false" autoincrement="false" lenght="19"/>
    		<NODE name="validityTo" type="datetime" nullable="true" autoincrement="false" lenght="19"/>
    		<NODE name="dateOfBirth" type="datetime" nullable="true" autoincrement="false" lenght="19"/>
    		<NODE name="sex" type="string" nullable="true" autoincrement="false" lenght="1"/>
    		<NODE name="maritalStatus" type="string" nullable="true" autoincrement="false" lenght="1"/>
    		<NODE name="nationality" type="string" nullable="true" autoincrement="false" lenght="3"/>
    		<NODE name="townOfBirth" type="string" nullable="true" autoincrement="false" lenght="45"/>
    </DATAMODEL>
