<DATAMODEL name="accountperiodtotal" xmlns:xsi="http://www.w3.org/2001/XMLSchema-instance" xsi:noNamespaceSchemaLocation="datamodel.xsd">
			<NODE name="accountNumber" type="string" nullable="false" autoincrement="false" lenght="20"/>
    		<NODE name="idBusinessUnit" type="int" nullable="false" autoincrement="false" lenght="11"/>
    		<NODE name="exercise" type="int" nullable="false" autoincrement="false" lenght="4"/>
    		<NODE name="currencyIsoCode" type="string" nullable="false" autoincrement="false" lenght="10"/>
    		<NODE name="periodId" type="int" nullable="false" autoincrement="false" lenght="11"/>
    		<NODE name="debit" type="float" nullable="true" autoincrement="false" lenght="19"/>
    		<NODE name="credit" type="float" nullable="true" autoincrement="false" lenght="19"/>
    		<NODE name="debitBlocked" type="float" nullable="true" autoincrement="false" lenght="19"/>
    		<NODE name="creditBlocked" type="float" nullable="true" autoincrement="false" lenght="19"/>
    		<NODE name="debitPaid" type="float" nullable="true" autoincrement="false" lenght="19"/>
    		<NODE name="creditPaid" type="float" nullable="true" autoincrement="false" lenght="19"/>
    		<NODE name="debitManual" type="float" nullable="true" autoincrement="false" lenght="19"/>
    		<NODE name="creditManual" type="float" nullable="true" autoincrement="false" lenght="19"/>
    		<NODE name="debitInvoice" type="float" nullable="true" autoincrement="false" lenght="19"/>
    		<NODE name="creditInvoice" type="float" nullable="true" autoincrement="false" lenght="19"/>
    		<NODE name="debitPaidDraft" type="float" nullable="true" autoincrement="false" lenght="19"/>
    		<NODE name="creditPaidDraft" type="float" nullable="true" autoincrement="false" lenght="19"/>
    		<NODE name="debitManualDraft" type="float" nullable="true" autoincrement="false" lenght="19"/>
    		<NODE name="creditManualDraft" type="float" nullable="true" autoincrement="false" lenght="19"/>
    		<NODE name="debitInvoiceDraft" type="float" nullable="true" autoincrement="false" lenght="19"/>
    		<NODE name="creditInvoiceDraft" type="float" nullable="true" autoincrement="false" lenght="19"/>
    		<NODE name="transactionCounter" type="int" nullable="true" autoincrement="false" lenght="11"/>
    </DATAMODEL>
