<DATAMODEL name="contactopenid" xmlns:xsi="http://www.w3.org/2001/XMLSchema-instance" xsi:noNamespaceSchemaLocation="datamodel.xsd">
			<NODE name="idContact" type="int" nullable="false" autoincrement="false" lenght="11"/>
    		<NODE name="idBusinessUnit" type="int" nullable="false" autoincrement="false" lenght="11"/>
    		<NODE name="validityFrom" type="datetime" nullable="false" autoincrement="false" lenght="19"/>
    		<NODE name="openId" type="string" nullable="false" autoincrement="false" lenght="255"/>
    		<NODE name="openIdType" type="string" nullable="false" autoincrement="false" lenght="45"/>
    		<NODE name="displayName" type="string" nullable="true" autoincrement="false" lenght="255"/>
    		<NODE name="roles" type="string" nullable="true" autoincrement="false" lenght="500"/>
    </DATAMODEL>
