<DATAMODEL name="contract" xmlns:xsi="http://www.w3.org/2001/XMLSchema-instance" xsi:noNamespaceSchemaLocation="datamodel.xsd">
			<NODE name="code" type="string" nullable="false" autoincrement="false" lenght="10"/>
    		<NODE name="idBusinessUnit" type="int" nullable="false" autoincrement="false" lenght="11"/>
    		<NODE name="idContact" type="int" nullable="false" autoincrement="false" lenght="11"/>
    		<NODE name="validityFrom" type="datetime" nullable="false" autoincrement="false" lenght="19"/>
    		<NODE name="validityTo" type="datetime" nullable="true" autoincrement="false" lenght="19"/>
    		<NODE name="name" type="string" nullable="true" autoincrement="false" lenght="45"/>
    		<NODE name="description" type="string" nullable="true" autoincrement="false" lenght="255"/>
    		<NODE name="algorithmName" type="string" nullable="true" autoincrement="false" lenght="100"/>
    		<NODE name="queryDefinition" type="string" nullable="true" autoincrement="false" lenght="100"/>
    		<NODE name="periodicity" type="string" nullable="true" autoincrement="false" lenght="1"/>
    		<NODE name="text" type="string" nullable="true" autoincrement="false" lenght="19"/>
    </DATAMODEL>
