<DATAMODEL name="contactthirdpartybanking" xmlns:xsi="http://www.w3.org/2001/XMLSchema-instance" xsi:noNamespaceSchemaLocation="datamodel.xsd">
			<NODE name="idContactThirdPartyBanking" type="int" nullable="false" autoincrement="true" lenght="11"/>
    		<NODE name="idContact" type="int" nullable="false" autoincrement="false" lenght="11"/>
    		<NODE name="idBusinessUnit" type="int" nullable="false" autoincrement="false" lenght="11"/>
    		<NODE name="name" type="string" nullable="true" autoincrement="false" lenght="255"/>
    		<NODE name="address" type="string" nullable="true" autoincrement="false" lenght="255"/>
    		<NODE name="postCode" type="string" nullable="true" autoincrement="false" lenght="20"/>
    		<NODE name="town" type="string" nullable="true" autoincrement="false" lenght="45"/>
    		<NODE name="iban" type="string" nullable="true" autoincrement="false" lenght="100"/>
    		<NODE name="bic" type="string" nullable="true" autoincrement="false" lenght="20"/>
    		<NODE name="account" type="string" nullable="true" autoincrement="false" lenght="100"/>
    		<NODE name="owner" type="string" nullable="true" autoincrement="false" lenght="255"/>
    		<NODE name="paymentForm" type="string" nullable="true" autoincrement="false" lenght="1"/>
    </DATAMODEL>
