<DATAMODEL name="invoice" xmlns:xsi="http://www.w3.org/2001/XMLSchema-instance" xsi:noNamespaceSchemaLocation="datamodel.xsd">
			<NODE name="invoiceName" type="string" nullable="false" autoincrement="false" lenght="30"/>
    		<NODE name="companyId" type="int" nullable="false" autoincrement="false" lenght="11"/>
    		<NODE name="invoiceExercise" type="int" nullable="false" autoincrement="false" lenght="4"/>
    		<NODE name="ownerModule" type="string" nullable="true" autoincrement="false" lenght="45"/>
    		<NODE name="ownerModuleFunction" type="string" nullable="true" autoincrement="false" lenght="45"/>
    		<NODE name="startDate" type="datetime" nullable="false" autoincrement="false" lenght="19"/>
    		<NODE name="closingDate" type="datetime" nullable="true" autoincrement="false" lenght="19"/>
    		<NODE name="deadlineDate" type="datetime" nullable="true" autoincrement="false" lenght="19"/>
    		<NODE name="expectedDate" type="datetime" nullable="true" autoincrement="false" lenght="19"/>
    		<NODE name="state" type="int" nullable="true" autoincrement="false" lenght="2"/>
    		<NODE name="subState" type="int" nullable="true" autoincrement="false" lenght="2"/>
    		<NODE name="description" type="string" nullable="true" autoincrement="false" lenght="4000"/>
    		<NODE name="comments" type="string" nullable="true" autoincrement="false" lenght="4000"/>
    		<NODE name="customerRef" type="string" nullable="true" autoincrement="false" lenght="45"/>
    		<NODE name="customerId" type="int" nullable="true" autoincrement="false" lenght="11"/>
    		<NODE name="businessUnitId" type="int" nullable="true" autoincrement="false" lenght="11"/>
    		<NODE name="invoiceAddressId" type="int" nullable="true" autoincrement="false" lenght="11"/>
    		<NODE name="invContactId" type="int" nullable="true" autoincrement="false" lenght="11"/>
    		<NODE name="invContactAddressId" type="int" nullable="true" autoincrement="false" lenght="11"/>
    		<NODE name="deliveryAddressId" type="int" nullable="true" autoincrement="false" lenght="8"/>
    		<NODE name="delContactId" type="int" nullable="true" autoincrement="false" lenght="11"/>
    		<NODE name="delContactAddressId" type="int" nullable="true" autoincrement="false" lenght="11"/>
    		<NODE name="businessContact" type="string" nullable="true" autoincrement="false" lenght="30"/>
    		<NODE name="technicalContact" type="string" nullable="true" autoincrement="false" lenght="30"/>
    		<NODE name="defaultTaxCode" type="string" nullable="true" autoincrement="false" lenght="5"/>
    		<NODE name="vatIncluded" type="string" nullable="true" autoincrement="false" lenght="1"/>
    		<NODE name="currencyCode" type="string" nullable="true" autoincrement="false" lenght="10"/>
    		<NODE name="priceInCurrency" type="float" nullable="true" autoincrement="false" lenght="19"/>
    		<NODE name="priceInCompanyCurrency" type="float" nullable="true" autoincrement="false" lenght="19"/>
    		<NODE name="vatAmountInCurrency" type="float" nullable="true" autoincrement="false" lenght="19"/>
    		<NODE name="vatAmountInCompanyCurrency" type="float" nullable="true" autoincrement="false" lenght="19"/>
    		<NODE name="original" type="string" nullable="true" autoincrement="false" lenght="255"/>
    		<NODE name="lastReminder" type="int" nullable="false" autoincrement="false" lenght="11"/>
    		<NODE name="alreadyPaidAmount" type="float" nullable="true" autoincrement="false" lenght="19"/>
    		<NODE name="flgManualDeadline" type="string" nullable="true" autoincrement="false" lenght="1"/>
    		<NODE name="paymentAccount" type="string" nullable="true" autoincrement="false" lenght="20"/>
    		<NODE name="reference" type="string" nullable="true" autoincrement="false" lenght="45"/>
    		<NODE name="vatPeriod" type="int" nullable="true" autoincrement="false" lenght="11"/>
    		<NODE name="accountExercise" type="int" nullable="false" autoincrement="false" lenght="4"/>
    		<NODE name="invoiceType" type="string" nullable="false" autoincrement="false" lenght="1"/>
    		<NODE name="jobNumber" type="string" nullable="true" autoincrement="false" lenght="45"/>
    		<NODE name="thirdPartyBank" type="int" nullable="true" autoincrement="false" lenght="11"/>
    		<NODE name="format" type="string" nullable="true" autoincrement="false" lenght="10"/>
    		<NODE name="parentInvoice" type="string" nullable="true" autoincrement="false" lenght="30"/>
    </DATAMODEL>
