<DATAMODEL name="account" xmlns:xsi="http://www.w3.org/2001/XMLSchema-instance" xsi:noNamespaceSchemaLocation="datamodel.xsd">
			<NODE name="number" type="string" nullable="false" autoincrement="false" lenght="20"/>
    		<NODE name="idBusinessUnit" type="int" nullable="false" autoincrement="false" lenght="11"/>
    		<NODE name="exercise" type="int" nullable="false" autoincrement="false" lenght="4"/>
    		<NODE name="name" type="string" nullable="true" autoincrement="false" lenght="45"/>
    		<NODE name="description" type="string" nullable="true" autoincrement="false" lenght="255"/>
    		<NODE name="taxCode" type="string" nullable="true" autoincrement="false" lenght="10"/>
    		<NODE name="parentAccountNumber" type="string" nullable="false" autoincrement="false" lenght="20"/>
    		<NODE name="sortNumber" type="string" nullable="true" autoincrement="false" lenght="20"/>
    		<NODE name="currencyCode" type="string" nullable="false" autoincrement="false" lenght="10"/>
    		<NODE name="status" type="string" nullable="true" autoincrement="false" lenght="45"/>
    		<NODE name="carryForward" type="string" nullable="true" autoincrement="false" lenght="1"/>
    		<NODE name="reconcile" type="string" nullable="true" autoincrement="false" lenght="1"/>
    		<NODE name="linkedAccount" type="string" nullable="true" autoincrement="false" lenght="20"/>
    		<NODE name="zeroBalance" type="string" nullable="true" autoincrement="false" lenght="1"/>
    		<NODE name="type" type="string" nullable="true" autoincrement="false" lenght="45"/>
    		<NODE name="manual" type="string" nullable="true" autoincrement="false" lenght="1"/>
    		<NODE name="category" type="string" nullable="true" autoincrement="false" lenght="45"/>
    </DATAMODEL>
